English	English	Synonym	Synonym	Synonym	Synonym	Russian	Russian	Russian	Russian	Russian	Synonym	Synonym	Synonym	Definition	Compare	See_also	See_also	See_also
Expanded Program on Immunization						Расширенная программа иммунизации								Программа Всемирной организации здравоохранения, глобальной целью которой является снижение смертности и заболеваемости корью, дифтерией, коклюшем, столбняком, полиомиелитом, туберкулезом путем проведения вакцинации. В программу могут включаться и другие заболевания, для профилактики которых созданы эффективные вакцины.					
experimental study						экспериментальное исследование													
expiration date (of vaccine)						срок годности (вакцины)								Дата, до которой препарат (вакцина) может быть использован(а).					
exposed population						население, оказавшееся под воздействием какого-либо фактора										exposure (воздействие)			
exposure						контакт с возбудителем инфекции	воздействие	экспозиция											
facilitator						инструктор	ведущий									course facilitator (инструктор учебного курса).			
facility-based routine surveillance						рутинный эпиднадзор на базе лечебного учреждения								Сведения о числе случаев регистрируемых заболеваний, выявленных сотрудниками ЛПУ за определенный период. Эти сведения периодически направляют в районные органы здравоохранения, а из них - в вышестоящие органы.		hospital-based infectious diseases surveillance (эпиднадзор за инфекционными болезнями на базе инфекционных стационаров).			
fact sheet						информационный бюллетень	фактические данные												
facultative anaerobe						факультативный анаэроб													
failure						неудача	провал												
false negative						ложно-отрицательный													
false positive						ложно-положительный													
fatality						летальность	летальный исход												
fatality rate						показатель летальности								Число летальных исходов, наблюдавшихся в группе лиц, пораженных определенным заболеванием. Выражается в процентах.					
febrile						лихорадочный								Сопровождающийся температурой.					
fetal death (stillbirth)						внутриутробная смерть								Смерть плода в утробе матери до его рождения или извлечения вне зависимости от срока беременности.					
fetal death rate						показатель внутриутробной смертности								Соотношение числа внутриутробных смертей за год и общего числа рождений за тот же период времени, умноженное на 1000.					
fetal death ratio						доля внутриутробной смертности								Соотношение числа внутриутробных смертей за год и числа живорожденных за тот же период времени.					
fever						лихорадка	жар	лихорадочное состояние						Повышение температуры тела, сопровождающееся ознобом.					
financial sustainability						финансовая устойчивость	устойчивое финансирование												
financial sustainability plans						планы (планирование) устойчивого финансирования								Документ, который разрабатывался странами, получающими поддержку по линии ГАВИ, в котором говорится о том, каким образом страна совместно со своими партнерами сумеет обеспечить необходимый уровень финансирования и сохранить достижения в области вакцинопрофилактики на этапе, когда закончится начальный период получения дополнительной поддержки от ГАВИ.В последующем стал частью Комплексного многолетнего плана (Comprehensive Multi-Year Plan)					
finished product						конечный (готовый) продукт								Продукт, прошедший все стадии производства, включая фасовку, маркировку и упаковку.					
fixed centre immunization						иммунизация, осуществляемая в медучреждении													
fixed facility						стационарное учреждение													
fixed immunization						иммунизация на базе ЛПУ									outreach immunization services (иммунизация на выезде).				
Fixed post						Стационарный прививочный пункт													
flagship course on immunization						флагманский учебный курс по иммунизации													
flask						матрас					матрац			Плоский сосуд, используемый для накопления биомассы микробов.					
flocculation						флоккуляции								Появление опалесценции или образование мелкодисперсного осадка при реакции “токсин, анатоксин - антитоксин”.					
fluctuation		fluid wave				флюктуация								Колебания в полости, наполненной жидкостью.					
fluorescent antibodies						флюоресцирующие антитела								Применяются в микробиологической диагностике.					
fluorescent antibody test (technique)						реакция иммунофлюоресценции													
foaming agent						пенообразователь													
focal transmission (of infection)						циркуляция (передача) возбудителя инфекции в пределах эпидемического очага													
focus						очаг (патологического процесса)								Также используется в более широком смысле - эпидемический очаг (focus of infection). Например, очаг циркуляции дикого полиовируса focus of wild poliovirus transmission).					
focus of infection						очаг инфекции										effective disease area (эпидемический очаг)	focus (очаг)	natural focus of disease (природный очаг болезни)	
focus group						фокусная группа	фокус-группа							Небольшая группа лиц, на основании беседы с которой проводится уточнение имеющихся у населения знаний по определенным вопросам здравоохранения, необходимости и возможности их изменения.					
focus group discussion						дискуссия в составе фокус-группы								Метод социальной и/или санитарно-просветительской работы.					
follow-up						последующее наблюдение	изучение отдаленных результатов	отслеживание						Наблюдение за человеком, группой людей или исходно определенной популяцией, характеристики которых были изначально оценены, для того, чтобы посмотреть, как они изменятся в будущем (например, состояние здоровья и любые относящиеся к здоровью параметры).		clinical follow-up examination (последующее клиническое обследование).			
follow-up study						последующее наблюдение	исследование с отслеживанием							Исследование, в котором отдельные люди или группы, отобранные по определенному признаку (контакт с фактором риска, профилактическое или лечебное вмешательство, наличие определенной характеристики) наблюдаются, чтобы оценить исход воздействия, вмешательства или влияния имеющейся у них характеристики, то есть заболевание.					
follow-up visit						последующее контрольное посещение (визит)									clinical follow-up examination (последующее клиническое обследование).				
fomites						фомиты								Неодушевленные предметы передачи возбудителя инфекции, например, вещи больного и т.д.					
Food and Drug Administration						Управление по контролю качества пищевых продуктов и медикаментов (и косметических средств)								Контрольный орган Министерства здравоохранения и социального обеспечения США.					
for-profit providers						поставщики платных услуг								В эту категорию поставщиков услуг входят частные лица и организации, реализующие услуги или продукцию за деньги.					
framework						структура	основа	схема											
freeze-dried vaccine		lyophilized vaccine				сухая лиофилизированная вакцина										lyophilized vaccine (лиофилизированная вакцина).			
freeze-drying		lyophilization				лиофилизация								Замораживание биологического материала с последующей сушкой в вакууме.					
freezer						морозильная камера								Применяется для хранения биологических препаратов при очень низкой температуре (минус 15 - минус 25°С).					
freeze indicator						индикатор замораживания (вакцин)								Термоиндикатор необратимого действия, представляет собой миниатюрную капсулу (ампулу), наполненную жидкостью. При температуре ниже 0°С капсула разрушается, жидкость разливается, образуя окрашенное пятно на белой бумаге подложки.					
freezing						замораживание								Например, случайное/неумышленное замораживание вакцины (inadvertent freezing).					
freons		chlorofluorocarbons				фреоны					хладоны	хлорфторуглеводороды		Органические газообразные или жидкие соединения, применяются как хладоносители в холодильниках и холодильных установках. Во исполнение требований Монреальского протокола международное сообщество приняло на себя обязательства по ликвидации таких холодильных установок и пенообразователей foaming agents).					
Freund's adjuvant						адъювант Фрейнда													
frequency distribution						плотность распределения					частотное распределение					distribution (распределение).			
front-loaded investment						фасадные инвестиции	инвестиции, работающие на опережение							Принцип, по которому существенные первоначальные инвестиции приводят к более низким долгосрочным затратам и пропорционально большему эффекту по сравнению с капиталовложениями, равномерно распределенными по срокам. ГАВИ и Фонд вакцин стараются найти территории, где заблаговременные инвестиции окупятся за счет сокращения долгосрочных затрат.					
frontloading						авансовое финансирование								Разработанный в рамках Международного механизма финансирования иммунизации (IFFIm) принцип финансирования, благодаря которому удастся ускорить привлечение дополнительных финансовых средств на проведение вакцинации и иммунизации в развивающихся странах.					
fully immunized child						полностью вакцинированный ребенок								Ребенок, получивший все прививки, полагающиеся ему по возрасту в соответствии с национальным календарем прививок.					
fund-raising						привлечение (активный сбор) финансовых ресурсов								Спланированная и согласованная деятельность, целью которой является привлечение внебюджетных финансовых ресурсов на осуществление конкретных проектов, программ, кампаний и т.д.					
funding						финансирование													
gamma globulin						гамма-глобулин										иммуноглобулины (immunoglobulins (Ig)).			
gasket						сальник								Прокладка в холодильных установках, автоклавах и др. устройствах.					
gel electrophoresis						электрофорез в геле								Лабораторный метод.		electrophoresis (электрофорез).			
gene						ген								Структурная и функциональная единица наследственности, контролирующая образование какого-либо признака, представляющая собой отрезок молекулы ДНК.					
gene sequencing		DNA sequencing				расшифровка последовательности ДНК					секвенирование ДНК			Выявление последовательности нуклеотидов в цепи.					
gene-spliced vaccine						генно-инженерная вакцина	рекомбинантная вакцина									recombinant vaccines (рекомбинантные (генно-инженерные) вакцины)			
generalized infection						генерализованная инфекция								Форма инфекционного заболевания, характеризующаяся множественными поражениями органов и тканей человека (животного).					
genome						геном								Генетическая информация, закодированная в клетке. Совокупность всех генов, определяющих структуру и активность организмов.					
genomic sequencing						определение (расшифровка) нуклеотидной последовательности генома								Расшифровка структуры генома путем выявления точной последовательности нуклеотидов					
genotype						генотип								Генетическая конституция - совокупность всех генов, присущих данной особи.					
geometric mean						средняя геометрическая (величина)								Усредненная величина, вычисляемая только для положительных величин путем получения их логарифмов, вычисления средней арифметической, а затем превращения в антилогарифм. Например, средняя геометрическая величина титров (антител) (geometric mean titers ).					
germs		organisms	microorganisms	bugs (coll.)		микроорганизмы										microorganisms (микроорганизмы).			
german measles		rubella				краснуха										rubella (краснуха).			
Global Action Plan on Laboratory Containment of Wild Polioviruses						Глобальный план действий по обеспечению безопасного лабораторного хранения диких полиовирусов													
Global Advisory Committee on Vaccine Safety						Глобальный консультативный комитет по безопасности вакцин								ГККБВ представляет собой научно-консультативный орган, который был учрежден ВОЗ с тем, чтобы проводить достоверные и независимые научно обоснованные оценки безопасности вакцин, оперативно и эффективно решать возникающие в этой связи вопросы, руководствуясь строгими научными доводами.					
Global Alliance for Vaccines and Immunization						Глобальный альянс по вакцинам и иммунизации								Международный альянс, включающий ведущих партнеров в области иммунизации, целью которого является защита детей от инфекций, контролируемых методами вакцинопрофилактики. Альянс разрабатывает и предлагает механизм координации и совершенствования программ иммунизации на международном, региональном и национальном уровнях, а также способствует сотрудничеству между уже существующими и новыми международными инициативами в области вакцинопрофилактики. Оказывает помощь наиболее бедным странам.					
GAVI Added Value						Дополнительная значимость усилий ГАВИ								ГАВИ обращает особое внимание на те участки работы, где ни один из партнеров в одиночку не сумеет работать эффективно или внести посильный вклад в коллективные усилия с участием других партнеров. В этом смысле наиболее перспективными являются четыре направления работы ГАВИ, а именно: координация и создание условий для достижения консенсуса; финансовая помощь странам по линии Фонда вакцин; нововведения; пропаганда и средства коммуникации.					
GAVI Alliance						Альянс ГАВИ													
GAVI Board						Совет ГАВИ								Руководящий орган ГАВИ					
GAVI Fund						Фонд ГАВИ								в прошлом Фонд вакцин (Vaccine Fund) Финансовый орган ГАВИ					
GAVI Principles						Руководящие принципы ГАВИ								Набор основополагающих принципов, которым следует Совет ГАВИ при принятии решений, касающихся выбора направлений деятельности для инвестирования средств Фонда вакцин.					
GAVI Strategic Framework						Основная схема оперативной деятельности ГАВИ													
GAVI Work Plan						План работы ГАВИ								План, отражающий направления деятельности, мероприятия и бюджет Секретариата ГАВИ и партнеров в рамках деятельности ГАВИ.					
global burden of disease						глобальное (мировое) бремя болезни								Оценка всех видов ущерба, наносимых мировому сообществу в целом тем или иным заболеванием.		Burden of disease (бремя болезни).			
Global Immunization Vision and Strategy						Глобальное видение и стратегия иммунизации								ГВСИ представляет собой 10-летний план работы (2006-2015 гг.), составляемый ВОЗ и ЮНИСЕФ при согласовании с широким кругом специалистов в области здравоохранения и иммунизации. При этом ставится задача единообразного восприятия главных целей вакцинопрофилактики на ближайшие годы и достижения договоренности по важнейшим стратегиям и направлениям работы для реализации поставленных целей.					
global network of laboratories						глобальная лабораторная сеть													
GMP certificate						сертификат соответствия GMP								Официальный документ, выданный НКО по месту нахождения производителя и подтверждающий соответствие производственного процесса принятым в стране требованиям.					
goal						цель								Конечный результат планируемых действий или программы. Например, ликвидация полиомиелита в мире к 2000 г.					
good manufacturing practice for medicinal products						правила производства и контроля качества лекарственных средств								В равной мере принципы GMP распространяются и на иммунобиологические препараты, в том числе на вакцины.					
good practice						надлежащая методика	надлежащие навыки	надлежащая практика						Применительно к обеспечению качества это процессы, которые определяются по критериям качества и безопасности на основании наиболее авторитетного экспертного мнения и реализуются в виде методов, процедур или количественных параметров, общепризнанных как оптимальные из всех имеющихся.					
Good Laboratory Practice						Надлежащая лабораторная практика								Процесс надлежащей организации лабораторного дела и обеспечение стандартов определенного качества на всех его этапах. Правила GLP предусматривают получение исходной документации, ясно отражающей проделанную работу и обеспечивающей возможность проверки.					
