English	English	Synonym	Synonym	Synonym	Synonym	Russian	Russian	Russian	Russian	Russian	Synonym	Synonym	Synonym	Definition	Compare	See_also	See_also	See_also
abscess						абсцесс													
absorptive capacity						способность страны-реципиента эффективно использовать внешнюю помощь													
accelerated degradation test						тест ускоренной деградации								Испытание вакцины на стабильность.					
Accelerated Development and Introduction Plans						Планы ускоренной разработки и внедрения													
Accelerated Disease Control						Активизация борьбы с болезнями								Стратегии для ускорения темпов борьбы с определенными инфекционными болезнями.					
accellular pertussis vaccine						бесклеточная (ацеллюлярная) коклюшная вакцина								Вакцина, содержащая очищенные инактивированные компоненты клеток В.pertussis.					
acceptable risk						приемлемый риск	приемлемая степень риска												
accreditation						аккредитация (лаборатории)								Процесс инспектирования лабораторий с целью подтверждения их соответствия определенным критериям.					
accuracy						точность	правильность												
acquired immunity		adaptive immunity				приобретенный иммунитет								Иммунитет, развившийся либо в ответ на воздействие естественного или искусственного антигена, либо в результате введения в организм иммунных сывороточных препаратов.					
acquired immunodeficiency syndrome						синдром приобретенного иммунодефицита													
active immunity						активный иммунитет								Иммунитет, развившийся в результате воздействия естественного или искусственного антигена (возбудителя инфекции или вакцины).					
active immunization						активная иммунизация								Введение медицинских иммунобиологических препаратов в организм с целью создания невосприимчивости к инфекционным болезням.					
active surveillance						активный эпиднадзор													
acute flaccid paralysis						острый вялый паралич								Синдром, который возникает при полиомиелите и ряде других заболеваний, например, при синдроме Гийена-Барре.					
acute (viral) hepatitis						острый (вирусный) гепатит													
adequate clinical specimens						адекватно собранные пробы клинического материала													
adequate stool specimens						адекватно собранные пробы стула								При эпиднадзоре за ОВП пробы стула, собранные в соответствии с требованиями.					
adjuvant						адъювант								Вещество, применяемое в комплексе с искусственным антигеном для усиления действия иммунобиологического препарата.					
administration of vaccine						введение вакцины										vaccine administration (введение вакцины).			
adsorbed (toxoid)						адсорбированный (анатоксин)								Токсин, очищенный и ослабленный специальным методом, адсорбированный на адъюванте для усиления иммуногенных свойств.					
Advanced Immunization Management						Оптимальное управление иммунопрофилактикой								Учебные модули включающие наиболее современную информацию для руководителей высшего звена с использованием методик интерактивного обучения, доступных в Интернете и на компакт-дисках. Веб-сайт AIM е-Learning: http://aim-e-learning.Stanford.edu/					
Advanced Market Commitments						Предварительные обязательства по будущим закупкам вакцин													
adverse event monitoring						мониторинг побочных проявлений (после иммунизации)													
adverse events following immunization						побочные проявления после иммунизации								Нарушения состояния здоровья, возникшие в период после иммунизации. Требуют тщательного расследования для установления связи с иммунизацией.					
adverse reaction						побочная реакция								Местные или общие клинические проявления реакции организма на введение иммунобиологического препарата (вакцины).					
advocacy						пропаганда и разъяснение								Термин используется в широком смысле и включает пропаганду, распространение сведений и целенаправленную разъяснительную работу.					
advocacy and communication						пропаганда и распространение информации													
Advisory Committee on Immunization						Консультативный комитет по иммунизации								Группа экспертов, разрабатывающая рекомендации в области иммунизации					
Advisory Committee on Immunization Practices						Консультативный комитет по методикам иммунизации								Экспертная группа CDC, США.					
age of infection		age at acquisition of infection	age at infection			возраст пациента в момент инфицирования													
age-sex register						реестр, составленный по возрасту и полу													
age-specific fertility rate						показатель фертильности в отдельных возрастных группах								Число живорожденных за год на 1000 женщин данной возрастной группы.					
age-specific incidence rate						показатель заболеваемости в определенной возрастной группе													
age-specific mortality rate						показатель смертности в определенной возрастной группе													
agent (causative)						возбудитель болезни								Этиологический агент (патоген), вызывающий инфекционный процесс (заболевание или носительство).					
agglutination test						реакция агглютинации								Лабораторный метод.					
aggravated history						отягощенный анамнез								Информация о нарушениях состояния здоровья у реципиента вакцины в прошлом, которые могут способствовать развитию поствакцинальных осложнений.					
aggregated data						сводные данные													
aggregate reporting						сводная отчетность								Суммарные данные (о количестве заболеваний).					
aggregate surveillance						эпиднадзор, основанный на сборе суммарных данных о конкретном заболевании													
airborne infections		aerial infections				воздушно-капельные инфекции													
allergic reaction						аллергическая реакция													
ampoule						ампула													
analytic(al) study						аналитическое исследование								Исследование, в ходе которого проверяют гипотезу о наличии причинно- следственной связи между заболеванием или состоянием здоровья или другой зависимой переменной и действием определенного фактора.					
anaphylactic shock						анафилактический шок								Тяжелая аллергическая реакция организма немедленного типа, иногда отмечающаяся при введении медицинского иммунобиологического препарата.					
animal model						экспериментальная модель на животном													
Annual Progress Report						Годовой отчет о выполнении работы								Документ ежегодно направляемый в Секретариат ГАВИ странами, получающими поддержку по линии ГАВИ.					
annualized non-polio AFP rate						частота случаев ОВП неполиомиелитной этиологии, приведенная к годовому показателю													
antenatal						антенатальный	дородовый												
antenatal clinic						клиника дородового наблюдения													
anthrax vaccine						сибиреязвенная вакцина													
antibody						антитело													
antibody-mediated immunity		humoral immunity				иммунитет, обусловленный антителами					гуморальный иммунитет								
antibody response						гуморальный иммунный ответ								Индуцированное антигеном образование антител.		immune response (иммунная реакция).			
antibody titer						титр антител								Разведение сыворотки крови, в котором можно обнаружить антитела.					
antibodies to HBsAg (anti-HBs)						антитела к поверхностному антигену вируса гепатита В (анти-HBs)													
antibody to hepatitis В core antigen (anti-HBc)						антитела к сердцевинному (“коровому”) антигену вируса гепатита В (анти-НВс)													
antigen						антиген								Чужеродное вещество, которое при введении в организм вызывает специфический иммунный ответ.					
antigen-antibody reaction						реакция антиген-антитело								Взаимодействие антигена и антитела in vivo или in vitro.					
antigen detection						выявление антигена													
antigenic competition						антигенная конкуренция								Иммунологический термин, обозначающий взаимоотношения сходных по химической структуре или родственных антигенов в иммунологических реакциях.					
antigenic shift						антигенный сдвиг					антигенный шифт			Внезапное изменение молекулярной структуры ДНК/РНК микроорганизма, особенно вирусов, приводящая к образованию нового антигенного варианта микроорганизма.					
antiserum		immune serum				иммунная сыворотка					антисыворотка			Содержит антитела к определенному антигену или возбудителю инфекционной болезни, применяется в диагностике и лечении.					
antitoxin						антитоксин								Антитела, продуцируемые организмом, в ответ на введение токсина (анатоксина).					
applied epidemiology						прикладная эпидемиология													
appropriate technology						оптимальная (соответствующая) технология (подход)								Технические приемы, знания, методы, процедуры и оборудование, которые адаптированы к конкретным потребностям на местах.					
arboviruses						арбовирусы													
arithmetic mean						средняя арифметическая (величина)													
aseptic meningitis						асептический менингит								Воспаление оболочек головного мозга, часто вызываемое вирусами.					
assessment						оценка													
attack rate						показатель поражённости								Вариант показателя заболеваемости, применяемый для ограниченной популяции в определенный промежуток времени, например, во время эпидемической вспышки.					
attenuated vaccine (strain)						аттенуированная вакцина (штамм)								Живая вакцина, изготовленная из ослабленного (аттенуированного) штамма возбудителя болезни.					
autism						аутизм													
autoantibodies						аутоантитела	аутоиммунные антитела							Вырабатываются организмом против антигенов собственных тканей.					
autoclave						автоклав								Аппарат для стерилизации медицинских инструментов, материалов или отходов с помощью водяного пара под давлением.		steam autoclaving (стерилизация паром).			
auto-disable syringe	AD syringe	autodestruct syringe (obs.)				самоблокирующийся (“саморазрушающийся”) шприц	СБ-шприц							Шприц, конструкция которого приводит его в негодность после первого использования, что делает его повторное применение невозможным.					
auto-reconstitution						автоматизированное разведение вакцины								В настоящее время разрабатывается технология использования лиофилизированной вакцины и растворителя, которая позволит совместить этапы разведения вакцины и ее введения.					
Bacillus Calmette-Guerin						Бацилла Кальметта-Герена								Аттенуированный штамм Mycobacterium bovis, используемый для производства вакцины против туберкулеза.		BCG vaccine (вакцина БЦЖ).			
bacterial meningitis						бактериальный менингит								Воспаление оболочек головного и спинного мозга, развивающееся в результате бактериальной инфекции.					
bacteremia						бактериемия								Наличие бактерий в циркулирующей крови.					
bacteriolysins						бактериолизины								Антитела, вызывающие лизис бактерий в присутствии комплемента.					
bacteriophage						бактериофаг	вирус бактерий	фаг											
bacterium						бактерия													
bar chart						столбиковая диаграмма								Графическое отображение переменных в виде столбцов					
Basic Support for Institutionalizing Child Survival						Оказание базовой поддержки в борьбе за выживание детей								Неправительственная организация.					
batch (lot)						серия (партия)								Определенное количество товара (препаратов, продуктов, материалов), произведенных в одном или нескольких технологических процессах так, что их можно считать однородными в рамках установленных пределов.		product lot (серия препарата).			
batch record						производственный протокол препарата								Все документы, касающиеся производства и контроля качества одной серии препарата.					
BCG vaccine						Вакцина БЦЖ													
bias						систематическая ошибка								Отклонение от истины результатов или выводов, или процесс, который ведет к такой ошибке.					
biological laboratory		biomedical laboratory				биологическая лаборатория													
biologicals						иммуно-биологические препараты													
bioreactor						биореактор					ферментер			Устройство, в котором при заданных условиях протекают биохимические реакции с участием живых микроорганизмов, клеточных экстрактов или ферментов.					
biosafety		biological safety				биологическая безопасность								Комплекс мер по защите от внутрилабораторного (в более широком смысле -внутрибольничного) заражения персонала и контаминации диагностического материала.		biosecurity (биозащищенность).			
biosafety cabinet						боксы микробиологической безопасности								Специальное ламинарное укрытие, бокс. Защитное устройство для обеспечения физического барьера между оператором и рабочим материалом. Служит для создания беспылевой воздушной среды.		laminar flow hoods (ламинарные шкафы (и боксы)).			
biosafety cabinet class I						бокс микробиологической безопасности I класса								Защитный шкаф с ламинарным потоком воздуха, обеспечивающий защиту диагностического материала от контаминации в процессе работы.		laminar flow hoods (ламинарные шкафы (и боксы)).			
biosafety cabinet class II						бокс микробиологической безопасности II класса								Защитный шкаф с ламинарным потоком воздуха, обеспечивающий одновременную защиту оператора от заражения и диагностического материала от контаминации в процессе работы.		laminar flow hoods (ламинарные шкафы (и боксы)).			
biosafety cabinet class III						бокс микробиологической безопасности III класса								Защитный шкаф, обеспечивает самый высокий уровень персональной защиты.		Laminar flow hoods (ламинарные шкафы (и боксы)).			
biosafety level						уровень биобезопасности (лабораторий)										laboratory safety (лабораторная безопасность).			
biosecurity						биозащищённость					биозащита	биобезопасность			biosafety (биобезопасность).				
birth cohort						когорта новорожденных								Совокупность лиц, рожденных за определенный период времени.					
birth dose						доза вакцины вводимая ребенку при рождении								в первые часы или дни жизни					
birth rate						показатель рождаемости								Отношение числа родов за определенный период времени к общей численности населения.	Death rate (показатель смертности).				
blind method		masked method				слепой метод								Способ организации исследования.					
blocking antibodies						блокирующие антитела								Антитела, препятствующие активности или других антител.					
blood-borne infection						инфекция, передаваемая через кровь													
booster dose		booster shot				бустерная доза								Дополнительная доза вакцины, вводимая после первичного курса иммунизации для повышения иммунного ответа.					
booster immunization						ревакцинация	бустерная иммунизация												
bovine serum albumin						бычий сывороточный альбумин													
break-seal ampoule						ампула с (легко) отламываемым кончиком													
breastfeeding woman						кормящая грудью женщина													
bridge financing						временное (промежуточное) финансирование								Один из принципов финансирования, используемых ГАВИ .					
buffer stock						резервный (буферный) запас													
bulk product (vaccine)						продукт (вакцина) предназначенный для разлива и упаковки								Продукт, прошедший все стадии производственного процесса, за исключением розлива и упаковки.					
burden of disease		disease burden				бремя болезни										environmental burden of disease (экологическое бремя болезни)	global burden of disease (глобальное бремя болезни).		
baseline data						исходные (отправные) данные													
benefit cost ratio						соотношение цена - выгода													
candidate vaccine						вакцина-кандидат								Вакцинный препарат на стадии разработки					
capacity building						наращивание (укрепление) потенциала													
carrier						носитель (возбудителя болезни)													
case						случай (заболевания)													
case-based data		line-listed data				поименные данные													
case-based surveillance						эпиднадзор, основанный на индивидуальных данных													
case-control study						исследование случай-контроль								Вид аналитического исследования, базирующегося на сравнении двух схожих групп с наличием случаев изучаемого явления и с отсутствием такового (контроль).					
case definition						определение случая (заболевания)								Набор стандартных критериев для решения вопроса о наличии определенной болезни, на основе клинических и/или лабораторных данных.		standard case definition			
case detection						выявление случая (заболевания)													
case-fatality rate						показатель летальности								Выраженная в процентах доля умерших лиц среди заболевших.					
