English	English	Synonym	Synonym	Synonym	Synonym	Russian	Russian	Russian	Russian	Russian	Synonym	Synonym	Synonym	Definition	Compare	See_also	See_also	See_also
pathogenesis						патогенез								Механизм развития болезни, патологического процесса и состояния.					
pathogenesis of immunity						патогенез иммунитета								Механизм развития иммунитета при заболевании.					
pattern						модель	структура	шаблон	особенность										
pentavalent vaccine						пятивалентная вакцина	пентавакцина							Вакцина, в состав которой входит пять антигенов (дифтерии, столбняка, коклюша, гепатита В и Hib).					
performance indicators						показатели качества работы								Конкретные согласованные показатели оценки работы систем, структур, организаций и работников.					
performance of the AFP surveillance system						эффективность системы эпиднадзора за ОВП													
performance, quality and safety criteria						критерии PQS (эксплуатационные характеристики (эффективность, производительность) - качество - безопасность)													
perinatal mortality						перинатальная смертность								Смертность плода в период с 28-й недели внутриутробной жизни по 7-е сутки жизни новорожденного.					
perinatal mortality rate						показатель перинатальной смертности								Число случаев смерти плода в период с 28-й недели внутриутробной жизни по 7-е сутки жизни новорожденного на 1000 родившихся живыми и мертвыми (с массой тела 1000 г+ при рождении).					
periodicity						периодичность (эпидемического процесса)								Закономерно чередующиеся подъемы и спады заболеваемости (многолетняя цикличность, внутригодовая цикличность - сезонность).		seasonal occurrence (сезонность).			
persistence of antigens						персистенция антигенов													
pertussis		whopping cough				коклюш								Одна из целевых инфекций Расширенной программы иммунизации ВОЗ .					
pertussis vaccine						коклюшная вакцина													
phenotype						фенотип								Совокупность всех признаков особи, формирующихся в процессе реализации ее генотипа в условиях внешней среды.					
pH-meter						индикатор рН								Определитель кислотности / щелочности среды.					
pilot investigation		pilot study				пилотное исследование								Ограниченное или выборочное исследование с целью изучить возможность проведения более широкого исследования.					
pilot project						пилотный (экспериментальный, поисковый) проект													
pipeline						процесс подготовки, разработки или доработки	канал информации, распределения или товародвижения							В последнее время словосочетание "in the pipeline" (в работе, в процессе, “на подходе”) часто встречается в документах, где речь идет о лекарственном					
pipeline stock						запасы в каналах сферы обращения								Запасы в каналах товародвижения (logistics, distribution channels), например, запасы в пути (in-transit inventory), товарные запасы (distribution inventory)					
placebo						плацебо								Индифферентный препарат, неотличимый от исследуемого препарата по внешнему виду, но не оказывающий специфического действия, используемый в качестве контроля при испытании иммунобиологических, фармацевтических и других препаратов.					
plastic foam						пенопласт								Термоизоляционный материал.					
plate		Petri dish				плашка	сип	чашка Петри	планшет для микротитрования										
Pneumococcal Accelerated Development and Introduction Plan						План по ускоренной разработке и внедрению пневмококковой вакцины								Проект "PneumoADIP", созданный ГАВИ для ускорения процессов оценки и расширения доступности новых пневмококковых вакцин для населения развивающихся стран.					
pneumonia						пневмония													
policy setting						разработка политики								Определение задач, путей и методов достижения программной цели.					
polio case investigation						расследование случая полиомиелита													
polio compatible case						случай, совместимый с полиомиелитом (с диагнозом полиомиелита)													
Polio Eradication Programme						Программа ликвидации полиомиелита													
polio free status						статус страны (региона, территории), свободной от полиомиелита													
polio specimen collection kit						набор для сбора проб для лабораторной диагностики полиомиелита													
poliomyelitis		polio				полиомиелит								Одна из целевых инфекций Расширенной программы иммунизации ВОЗ .					
poliovaccine						вакцина против полиомиелита	полиовакцина												
political commitment						политические обязательства	политическая приверженность									commitment (обязательство, приверженность).			
polymerase chain reaction						полимеразная цепная реакция								Лабораторный метод. Метод амплификации ДНК in vitro					
polysaccharides						полисахариды								Углеводы с большой молекулярной массой.					
poor immune (serologic) response						слабый иммунный (серологический, антительный) ответ										immune response (иммунный ответ).			
pop-open ampoule						ампула с легко отбиваемым (отламываемым) колпачком													
population						население	популяция												
population access						доступность (доступ) для населения													
population immunity		herd immunity	community immunity			коллективный иммунитет										herd immunity (коллективный иммунитет).			
portable						портативный													
post-exposure immunoprophylaxis						иммунопрофилактика лиц, контактировавших с источником возбудителя инфекции	постэкспозиционная иммунопрофилактика												
postimmunization syndrome						поствакцинальный синдром								Возможный (ожидаемый) комплекс местных и общих реакций на введение вакцины.					
postmarketing surveillance						пострегистрационный надзор за качеством препарата								Мероприятия по контролю безопасности, активности и эффективности препарата после его регистрации и при его использовании в практике здравоохранения.					
post-pandemic seasonal fluvaccine						гриппозная вакцина для профилактики сезонного подъема Заболеваемости гриппом в период после пандемии													
postvaccinal complications						поствакцинальные осложнения										adverse reaction (побочная реакция).			
potency (of vaccine)						специфическая активность вакцины								Способность вакцины вызывать иммунитет.					
Poverty Reduction Strategy						Стратегия сокращения (масштабов) нищеты													
Poverty Reduction Strategy Paper						Документ о реализации стратегии сокращения масштабов нищеты													
precipitation reaction						реакция преципитации													
precipitins						преципитины								Антитела, образующие с растворимым антигеном комплекс, способный выпадать в осадок.					
Pre-filled, single-dose, non-reusable devices						Готовые к использованию однодозовые одноразовые инъекционные устройства (шприц-тюбик)													
pre-filled syringe						готовый к использованию шприц с вакциной													
pregnant woman						беременная													
preparation						препарат													
prequalification						преквалификация (вакцины)													
preservative (agent)						консервант	стабилизатор							Вещество, применяемое для сохранения вакцины, не подавляющее ее активность .					
prevalence						поражённость распространенность								Суммарная совокупность случаев клинически выраженных заболеваний и/или носительства возбудителя какой-либо инфекционной (паразитарной) болезни среди населения определенной территории в определенный отрезок времени.					
prevalence rate		proportion prevalence				показатель поражённости								Общее число лиц, пораженных болезнью (как манифестными формами, так и случаи носительства возбудителя) в определенный промежуток времени, деленное на численность группы риска в данный момент или за данный период времени.					
prevention						профилактика	предотвращение							Комплекс санитарно-гигиенических, лечебно-профилактических и административных мероприятий, направленных на предупреждение возникновения инфекционных (паразитарных) болезней.					
preventive intervention						профилактическое мероприятие													
primary cells						эмбриональные клетки													
primary dose						первичная доза								Доза вакцины, вызывающая первичный иммунный ответ.					
primary health care						первичная медико-санитарная помощь													
primary inoculation						первичное заражение	первичная инокуляция	первичная прививка											
primary vaccine store						центральный вакцинный склад								Основной или базовый склад в стране, получающий вакцину непосредственно от поставщика.					
priming						прайминг								Первичное воздействие антигена. Не всегда вызывает продукцию определимого количества антител, но, тем не менее, приводит к возникновению иммунологической памяти и способности к сильному вторичному иммунному ответу					
priority setting						выбор приоритетов								Выбор первоочередных целей и задач в зависимости от имеющихся потребностей и возможностей.					
private sector						частный сектор								Частный сектор включает в себя неправительственные организации и коммерческие структуры.					
probability						вероятность													
probability sample		random sample				вероятностная выборка					случайная выборка								
probiotics						пробиотики								Апатогенные для человека бактерии, обладающие антагонистической активностью в отношении патогенных и условно патогенных бактерий и обеспечивающие восстановление нормальной микрофлоры.					
procurement		physical supply				снабжение	обеспечение	закупка						Процесс материально-технического обеспечения потребителя, включая закупки и доставку препаратов, сырья и материалов.		purchasing (закупка).			
product certificate						сертификат производства								Документ, подтверждающий, что условия производства и контроля на предприятии обеспечивают выпуск препаратов, соответствующих установленным требованиям.					
product information sheets						информационные таблицы по оборудованию	каталог оборудования												
product lot						серия препарата								Совокупность образцов препарата, полученных в результате одного технологического процесса.		batch (lot) (серия (партия)).			
product reactogenicity						реактогенность препарата								Способность препарата (вакцины) вызывать при введении в организм какие- либо нарушения состояния здоровья.					
product sample						образец препарата								Определенное количество материала, взятое из данной серии препарата.					
product specification files						нормативная документация								Комплекс документов, устанавливающих требования к готовому препарату, его изготовителю, контролю, условиям хранения, транспортирования и применения.					
proficiency						опытность	навыки	умение											
proficiency testing						проверка квалификации или профессионального соответствия													
proficiency testing panels						панели (набор тестов) для проверки профессионального соответствия (лабораторий)													
profile						краткий очерк	обзор	характеристика	портрет					Статистический отчет с изложением заданной информации по конкретному предмету. В оперативной деятельности ВОЗ этот термин чаще всего используется в связи с формированием национального информационно- аналитического обзора по стране (country profile) или с характеристикой реактогенных свойств вакцин (AEFI profile of vaccine).					
program for appropriate technologies in health						программа оптимальных технологий в здравоохранении													
programmatic						предусмотренный планом, политикой или программой								Очень ёмкое понятие, адекватный перевод которого во многом зависит от контекста.					
programmatically						в соответствии с программой комплексных мероприятий по вакцинопрофилактике	с позиций комплексного подхода к вакцинопрофилактике												
critical programmatic information						важнейшая информация, касающаяся объема необходимых мероприятий													
programmatic action						предусмотренные (программой) мероприятия	необходимый комплекс мероприятий												
programmatic error						ошибка в программной деятельности													
programmatic intervention gaps						нерешенные проблемы в целенаправленной практической деятельности													
programme review						оценка программы								Оценка планов, действий и специфических задач по достижению поставленной цели, а также использования необходимых ресурсов.					
propagator						культиватор	ферментер							Ёмкость для выращивания культур микроорганизмов и клеток тканей.					
prophylaxis						профилактика										prevention (профилактика).			
proportion						доля	отношение	пропорция											
prospective (cohort) study						проспективное (когортное) исследование										cohort study (когортное исследование).			
protected at birth		protection at birth status				иммунокомпетентный при рождении													
protective antigens						протективные антигены								Антигены возбудителей инфекционных болезней, иммунный ответ на которые обеспечивает защиту от данного заболевания или его тяжелых форм .					
protective level of antibodies						защитный уровень антител								Титр, концентрация антител, достаточные для предотвращения развития заболевания.					
protocol						план (программа, алгоритм) действий								Описание цели, задач, этапов проведения исследования или программы.					
public						общественность	общественный												
public affairs						общественные дела								В санитарном просвещении - деятельность, проводимая в общественных интересах.					
public health						общественное здравоохранение										health (здравоохранение).			
public relations						связь с общественностью								Деятельность, направленная на установление и развитие связей с общественностью, на формирование позитивного общественного мнения о предлагаемых или оказываемых услугах.					
public health sector						государственный сектор здравоохранения								В государственный сектор входят министерства здравоохранения, государственные больницы и другие лечебно-профилактические учреждения, финансируемые из государственного или муниципального бюджета.					
publicity						действия или материалы, отображающие пользу и необходимость определенного вида деятельности													
pulse campaign		pulse immunization				кампании иммунизации, проводимые с определенной цикличностью													
puncture (piercing) proof container		safety box	safety container	safe disposal box	sharps container	непрокалываемый контейнер для остроконечных предметов								Емкость для сбора отработанных медицинских остроконечных предметов (например, игл).		safety box (контейнер безопасности)	sharps container (контейнер)		
purchasing		purchase	procurement			закупка	приобретение							В узком смысле - процесс закупки препаратов, сырья, расходных материалов, оборудования и др. В широком смысле в это понятие включаются и другие функции, например, контроль правильности цен на поставляемое сырье, оценивание поставщиков (vendor analysis), отслеживание грузов (shipment tracking).		procurement (снабжение).			
pure transformer regulator						автотрансформатор													
purified						очищенный													
purified protein derivative						очищенный белковый дериват (производное)								Сокращенное наименование туберкулина повышенной специфичности, применяемого в настоящее время. В России используется оригинальный препарат, предложенный М.А.Линниковой, поэтому к аббревиатуре добавляется русская буква Л: PPD-Л.					
pyrogens						пирогены								Вещества различного происхождения, вызывающие повышение температуры тела при их парентеральном введении.					
qualitative immunoassay						качественный иммунный анализ								Лабораторный метод.					
qualitative research						качественные исследования								Вид исследования, в котором используется нецифровая информация для изучения индивидуальных или групповых характеристик.					
quality-adjusted life years						индекс qaly	показатель, отражающий скорректированные на качество жизни годы							Коррекция показателя ожидаемой продолжительности жизни (life expectancy), которая снижает ОПЖ на величину, отражающую наличие хронических заболеваний, ухудшающих состояние, потерю трудоспособности и/или инвалидность на основании анализа результатов медицинских обследований, информации о выписке из больниц и т.д.		disability-adjusted life years.			
quality assessment						оценка качества													
